{
  "kind": "Handoff",
  "schemaVersion": "0.1.0",
  "id": "handoff-2026-09-21-cycle1",
  "date": "2026-09-21",
  "cycle": "Cycle 1 thin vertical",
  "author": {
    "actorType": "AGENT",
    "actorId": "orchestrator"
  },
  "summary": "Cycle 1 thin vertical: deterministic validateProfile, classifyRisk 0.1.0, selectModules, idea/form intake, compiler emitting a five-file markdown Project OS stub, POST /os/api/compile ZIP/JSON, and a /os demo UI. No model calls, no publish, capability registry unchanged. Not production-ready; compile API is unauthenticated.",
  "filesChanged": [
    { "path": ".project-os/state.json", "change": "MODIFIED" },
    { "path": "FILE_INDEX.md", "change": "MODIFIED" },
    { "path": "README.md", "change": "MODIFIED" },
    { "path": "apps/server/package.json", "change": "MODIFIED" },
    { "path": "apps/server/src/app.ts", "change": "MODIFIED" },
    { "path": "apps/server/test/compile.test.ts", "change": "ADDED" },
    { "path": "apps/web/index.html", "change": "MODIFIED" },
    { "path": "apps/web/src/main.tsx", "change": "MODIFIED" },
    { "path": "apps/web/src/tokens.css", "change": "MODIFIED" },
    { "path": "handoffs/2026-09-21-cycle1.json", "change": "ADDED" },
    { "path": "handoffs/2026-09-21-cycle1.md", "change": "ADDED" },
    { "path": "package-lock.json", "change": "MODIFIED" },
    { "path": "packages/core/package.json", "change": "MODIFIED" },
    { "path": "packages/core/src/assessments.ts", "change": "ADDED" },
    { "path": "packages/core/src/classify-risk.ts", "change": "ADDED" },
    { "path": "packages/core/src/compile.ts", "change": "ADDED" },
    { "path": "packages/core/src/index.ts", "change": "MODIFIED" },
    { "path": "packages/core/src/profile-from-idea.ts", "change": "ADDED" },
    { "path": "packages/core/src/run-compile.ts", "change": "ADDED" },
    { "path": "packages/core/src/select-modules.ts", "change": "ADDED" },
    { "path": "packages/core/src/types.ts", "change": "ADDED" },
    { "path": "packages/core/src/validate-profile.ts", "change": "ADDED" },
    { "path": "packages/core/src/zip.ts", "change": "ADDED" },
    { "path": "packages/core/test/compile.test.mjs", "change": "ADDED" },
    { "path": "packages/core/test/fixtures/select/ai-app.json", "change": "ADDED" },
    { "path": "packages/core/test/fixtures/select/desktop-p1.json", "change": "ADDED" },
    { "path": "packages/core/test/fixtures/select/ecommerce-no-pay.json", "change": "ADDED" },
    { "path": "packages/core/test/fixtures/select/ecommerce-ok.json", "change": "ADDED" },
    { "path": "packages/core/test/fixtures/select/payments-marketplace.json", "change": "ADDED" },
    { "path": "packages/core/test/fixtures/select/web-saas.json", "change": "ADDED" },
    { "path": "packages/core/test/select-modules.test.mjs", "change": "ADDED" },
    { "path": "packages/core/test/validate-profile.test.mjs", "change": "ADDED" },
    { "path": "state/CURRENT_STATE.md", "change": "MODIFIED" },
    { "path": "state/IMPLEMENTATION_INVENTORY.md", "change": "MODIFIED" },
    { "path": "state/KNOWN_ISSUES.md", "change": "MODIFIED" },
    { "path": "state/NEXT_ACTIONS.md", "change": "MODIFIED" },
    { "path": "state/TECH_DEBT.md", "change": "MODIFIED" }
  ],
  "checks": [
    {
      "name": "spec checks",
      "command": "npm run check",
      "result": "PASS",
      "summary": "10/10: schemas, fixtures, mutations, registries, machine/Markdown, FILE_INDEX, no nested AGENTS.md, secret scan.",
      "at": "2026-09-21T03:30:00Z"
    },
    {
      "name": "full workspace tests",
      "command": "npm test",
      "result": "PASS",
      "summary": "check 10/10; server 6/6 (healthz + compile ZIP/JSON + invalid profile); core 16/16 (boundary, goldens, shuffle-invariance, compile determinism).",
      "at": "2026-09-21T03:30:00Z"
    },
    {
      "name": "web production build",
      "command": "npm run build",
      "result": "PASS",
      "summary": "Vite build succeeded for /os SPA.",
      "at": "2026-09-21T03:30:00Z"
    },
    {
      "name": "web type-check",
      "command": "npx tsc -p apps/web/tsconfig.json --noEmit",
      "result": "PASS",
      "summary": "TypeScript noEmit clean.",
      "at": "2026-09-21T03:30:00Z"
    }
  ],
  "gates": [
    { "gate": "G0", "result": "PASS", "ref": "gates/results/G0-2026-09-13-cycle0.json" },
    { "gate": "G1", "result": "PASS", "ref": "gates/results/G1-2026-09-13-cycle0.json" },
    { "gate": "G2", "result": "NOT_EVALUATED" },
    { "gate": "G3", "result": "NOT_EVALUATED" },
    { "gate": "G4", "result": "NOT_EVALUATED" },
    { "gate": "G5", "result": "NOT_EVALUATED" },
    { "gate": "G6", "result": "NOT_EVALUATED" },
    { "gate": "G7", "result": "NOT_EVALUATED" },
    { "gate": "DESIGN_REVIEW", "result": "NOT_EVALUATED" },
    { "gate": "COST_REVIEW", "result": "NOT_EVALUATED" }
  ],
  "blockers": [],
  "openDecisions": [
    { "id": "OD-6", "question": "AI data policy", "blocks": "M3 with real users" },
    { "id": "OD-8", "question": "CI provider confirmation (git exists)", "blocks": "CI for M1 remainder" },
    { "id": "OD-11", "question": "Define Project Genome; 1stStep OS Audit integration scope", "blocks": "Audit integration work" }
  ],
  "nextRecommendedCycle": {
    "objective": "M1 remainder (packages/schemas plus remaining module goldens) or M2 platform skeleton (auth, tenancy, Postgres) so /os/api/compile is not public.",
    "milestoneIds": ["M1", "M2"],
    "entryCriteria": ["npm test green", "Cycle 1 thin vertical merged or still on this branch"]
  }
}
